{"audit_chain_id":"audit.fixture","created_at":"2026-07-14T00:00:02Z","details_digest":"4444444444444444444444444444444444444444444444444444444444444444","event_digest":"b27130773380781c6b5fe091173770aef362440834237af81bf23ff316d56153","event_id":"audit.fixture.0","message":"fixture event","operation":"install_local","phase":"completed","plan_id":"plan.fixture","previous_event_digest":null,"schema":"usk.audit_event.v1","sequence":0,"status":"pass","subject":{"subject_id":"install.fixture","subject_type":"installation"},"transaction_id":"tx.fixture"}
